display_symbol,provider_symbol,name,exchange,currency,asset_type,is_bist,is_active,source,source_date
DNYVA,DNYVA.IS,DÜNYA VARLIK YÖNETİM A.Ş.,XIST,TRY,equity,true,true,https://www.kap.org.tr/tr/bist-sirketler,2026-07-03
DNZEN,DNZEN.IS,DENİZ EKO ENERJİ VE GERİ DÖNÜŞÜM A.Ş.,XIST,TRY,equity,true,true,https://www.kap.org.tr/tr/bist-sirketler,2026-07-03
DOAS,DOAS.IS,DOĞUŞ OTOMOTİV SERVİS VE TİCARET A.Ş.,XIST,TRY,equity,true,true,https://www.kap.org.tr/tr/bist-sirketler,2026-07-03
DOCO,DOCO.IS,DO & CO AKTIENGESELLSCHAFT,XIST,TRY,equity,true,true,https://www.kap.org.tr/tr/bist-sirketler,2026-07-03
DOFER,DOFER.IS,DOFER YAPI MALZEMELERİ SANAYİ VE TİCARET A.Ş.,XIST,TRY,equity,true,true,https://www.kap.org.tr/tr/bist-sirketler,2026-07-03
DOFRB,DOFRB.IS,DOF ROBOTİK SANAYİ A.Ş.,XIST,TRY,equity,true,true,https://www.kap.org.tr/tr/bist-sirketler,2026-07-03
DOGUB,DOGUB.IS,DOĞUSAN BORU SANAYİ VE TİCARET A.Ş.,XIST,TRY,equity,true,true,https://www.kap.org.tr/tr/bist-sirketler,2026-07-03
DOGVY,DOGVY.IS,DOĞRU VARLIK YÖNETİM A.Ş.,XIST,TRY,equity,true,true,https://www.kap.org.tr/tr/bist-sirketler,2026-07-03
DOHOL,DOHOL.IS,DOĞAN ŞİRKETLER GRUBU HOLDİNG A.Ş.,XIST,TRY,equity,true,true,https://www.kap.org.tr/tr/bist-sirketler,2026-07-03
DOKTA,DOKTA.IS,DÖKTAŞ DÖKÜMCÜLÜK TİCARET VE SANAYİ A.Ş.,XIST,TRY,equity,true,true,https://www.kap.org.tr/tr/bist-sirketler,2026-07-03
DRPHN,DRPHN.IS,T.C. HAZİNE VE MALİYE BAKANLIĞI DARPHANE VE DAMGA MATBAASI GENEL MÜDÜRLÜĞÜ,XIST,TRY,equity,true,true,https://www.kap.org.tr/tr/bist-sirketler,2026-07-03
DSTKF,DSTKF.IS,DESTEK FİNANS FAKTORİNG A.Ş.,XIST,TRY,equity,true,true,https://www.kap.org.tr/tr/bist-sirketler,2026-07-03
DSYAT,DSYAT.IS,DESTEK YATIRIM MENKUL DEĞERLER A.Ş.,XIST,TRY,equity,true,true,https://www.kap.org.tr/tr/bist-sirketler,2026-07-03
DUNYH,DUNYH.IS,DÜNYA HOLDİNG A.Ş.,XIST,TRY,equity,true,true,https://www.kap.org.tr/tr/bist-sirketler,2026-07-03
DURDO,DURDO.IS,DURAN DOĞAN BASIM VE AMBALAJ SANAYİ A.Ş.,XIST,TRY,equity,true,true,https://www.kap.org.tr/tr/bist-sirketler,2026-07-03
DURKN,DURKN.IS,DURUKAN ŞEKERLEME SANAYİ VE TİCARET A.Ş.,XIST,TRY,equity,true,true,https://www.kap.org.tr/tr/bist-sirketler,2026-07-03
DVRLK,DVRLK.IS,D VARLIK KİRALAMA A.Ş.,XIST,TRY,equity,true,true,https://www.kap.org.tr/tr/bist-sirketler,2026-07-03
DYBNK,DYBNK.IS,D YATIRIM BANKASI A.Ş.,XIST,TRY,equity,true,true,https://www.kap.org.tr/tr/bist-sirketler,2026-07-03
DYOBY,DYOBY.IS,DYO BOYA FABRİKALARI SANAYİ VE TİCARET A.Ş.,XIST,TRY,equity,true,true,https://www.kap.org.tr/tr/bist-sirketler,2026-07-03
DZGYO,DZGYO.IS,DENİZ GAYRİMENKUL YATIRIM ORTAKLIĞI A.Ş.,XIST,TRY,equity,true,true,https://www.kap.org.tr/tr/bist-sirketler,2026-07-03
EBEBK,EBEBK.IS,EBEBEK MAĞAZACILIK A.Ş.,XIST,TRY,equity,true,true,https://www.kap.org.tr/tr/bist-sirketler,2026-07-03
ECILC,ECILC.IS,EİS ECZACIBAŞI İLAÇ SINAİ VE FİNANSAL YATIRIMLAR SANAYİ VE TİCARET A.Ş.,XIST,TRY,equity,true,true,https://www.kap.org.tr/tr/bist-sirketler,2026-07-03
ECOGR,ECOGR.IS,ECOGREEN ENERJİ HOLDİNG A.Ş.,XIST,TRY,equity,true,true,https://www.kap.org.tr/tr/bist-sirketler,2026-07-03
ECZIP,ECZIP.IS,EİP ECZACIBAŞI İLAÇ PAZARLAMA A.Ş.,XIST,TRY,equity,true,true,https://www.kap.org.tr/tr/bist-sirketler,2026-07-03
ECZYT,ECZYT.IS,ECZACIBAŞI YATIRIM HOLDİNG ORTAKLIĞI A.Ş.,XIST,TRY,equity,true,true,https://www.kap.org.tr/tr/bist-sirketler,2026-07-03
EDATA,EDATA.IS,E-DATA TEKNOLOJİ PAZARLAMA A.Ş.,XIST,TRY,equity,true,true,https://www.kap.org.tr/tr/bist-sirketler,2026-07-03
EDIP,EDIP.IS,EDİP GAYRİMENKUL YATIRIM SANAYİ VE TİCARET A.Ş.,XIST,TRY,equity,true,true,https://www.kap.org.tr/tr/bist-sirketler,2026-07-03
EFOR,EFOR.IS,EFOR YATIRIM SANAYİ TİCARET A.Ş.,XIST,TRY,equity,true,true,https://www.kap.org.tr/tr/bist-sirketler,2026-07-03
EGEEN,EGEEN.IS,EGE ENDÜSTRİ VE TİCARET A.Ş.,XIST,TRY,equity,true,true,https://www.kap.org.tr/tr/bist-sirketler,2026-07-03
EGEGY,EGEGY.IS,EGEYAPI AVRUPA GAYRİMENKUL YATIRIM ORTAKLIĞI A.Ş.,XIST,TRY,equity,true,true,https://www.kap.org.tr/tr/bist-sirketler,2026-07-03
EGEPO,EGEPO.IS,NASMED ÖZEL SAĞLIK HİZMETLERİ TİCARET A.Ş.,XIST,TRY,equity,true,true,https://www.kap.org.tr/tr/bist-sirketler,2026-07-03
EGGUB,EGGUB.IS,EGE GÜBRE SANAYİİ A.Ş.,XIST,TRY,equity,true,true,https://www.kap.org.tr/tr/bist-sirketler,2026-07-03
EGPRO,EGPRO.IS,EGE PROFİL TİCARET VE SANAYİ A.Ş.,XIST,TRY,equity,true,true,https://www.kap.org.tr/tr/bist-sirketler,2026-07-03
EGSER,EGSER.IS,EGE SERAMİK SANAYİ VE TİCARET A.Ş.,XIST,TRY,equity,true,true,https://www.kap.org.tr/tr/bist-sirketler,2026-07-03
EKDMR,EKDMR.IS,EKİNCİLER DEMİR VE ÇELİK SANAYİ A.Ş.,XIST,TRY,equity,true,true,https://www.kap.org.tr/tr/bist-sirketler,2026-07-03
EKER,EKER.IS,EKER SÜT ÜRÜNLERİ GIDA SANAYİ VE TİCARET A.Ş.,XIST,TRY,equity,true,true,https://www.kap.org.tr/tr/bist-sirketler,2026-07-03
EKGYO,EKGYO.IS,EMLAK KONUT GAYRİMENKUL YATIRIM ORTAKLIĞI A.Ş.,XIST,TRY,equity,true,true,https://www.kap.org.tr/tr/bist-sirketler,2026-07-03
EKIZ,EKIZ.IS,EKİZ KİMYA SANAYİ VE TİCARET A.Ş.,XIST,TRY,equity,true,true,https://www.kap.org.tr/tr/bist-sirketler,2026-07-03
EKOFA,EKOFA.IS,EKO FAKTORİNG A.Ş.,XIST,TRY,equity,true,true,https://www.kap.org.tr/tr/bist-sirketler,2026-07-03
EKOS,EKOS.IS,EKOS TEKNOLOJİ VE ELEKTRİK A.Ş.,XIST,TRY,equity,true,true,https://www.kap.org.tr/tr/bist-sirketler,2026-07-03
EKSUN,EKSUN.IS,EKSUN GIDA TARIM SANAYİ VE TİCARET A.Ş.,XIST,TRY,equity,true,true,https://www.kap.org.tr/tr/bist-sirketler,2026-07-03
EKTVK,EKTVK.IS,EMLAK KATILIM VARLIK KİRALAMA A.Ş.,XIST,TRY,equity,true,true,https://www.kap.org.tr/tr/bist-sirketler,2026-07-03
ELITE,ELITE.IS,ELİTE NATUREL ORGANİK GIDA SANAYİ VE TİCARET A.Ş.,XIST,TRY,equity,true,true,https://www.kap.org.tr/tr/bist-sirketler,2026-07-03
EMIRV,EMIRV.IS,EMİR VARLIK YÖNETİM A.Ş.,XIST,TRY,equity,true,true,https://www.kap.org.tr/tr/bist-sirketler,2026-07-03
EMKEL,EMKEL.IS,EMEK ELEKTRİK ENDÜSTRİSİ A.Ş.,XIST,TRY,equity,true,true,https://www.kap.org.tr/tr/bist-sirketler,2026-07-03
EMNIS,EMNIS.IS,EMİNİŞ AMBALAJ SANAYİ VE TİCARET A.Ş.,XIST,TRY,equity,true,true,https://www.kap.org.tr/tr/bist-sirketler,2026-07-03
EMPAE,EMPAE.IS,EMPA ELEKTRONİK SANAYİ VE TİCARET A.Ş.,XIST,TRY,equity,true,true,https://www.kap.org.tr/tr/bist-sirketler,2026-07-03
EMVAR,EMVAR.IS,EMLAK VARLIK KİRALAMA A.Ş.,XIST,TRY,equity,true,true,https://www.kap.org.tr/tr/bist-sirketler,2026-07-03
ENDAE,ENDAE.IS,ENDA ENERJİ HOLDİNG A.Ş.,XIST,TRY,equity,true,true,https://www.kap.org.tr/tr/bist-sirketler,2026-07-03
ENERY,ENERY.IS,ENERYA ENERJİ A.Ş.,XIST,TRY,equity,true,true,https://www.kap.org.tr/tr/bist-sirketler,2026-07-03
ENJSA,ENJSA.IS,ENERJİSA ENERJİ A.Ş.,XIST,TRY,equity,true,true,https://www.kap.org.tr/tr/bist-sirketler,2026-07-03
ENKAI,ENKAI.IS,ENKA İNŞAAT VE SANAYİ A.Ş.,XIST,TRY,equity,true,true,https://www.kap.org.tr/tr/bist-sirketler,2026-07-03
ENPRA,ENPRA.IS,ENPARA BANK A.Ş.,XIST,TRY,equity,true,true,https://www.kap.org.tr/tr/bist-sirketler,2026-07-03
ENSRI,ENSRI.IS,ENSARİ SINAİ YATIRIMLAR A.Ş.,XIST,TRY,equity,true,true,https://www.kap.org.tr/tr/bist-sirketler,2026-07-03
ENTRA,ENTRA.IS,IC ENTERRA YENİLENEBİLİR ENERJİ A.Ş.,XIST,TRY,equity,true,true,https://www.kap.org.tr/tr/bist-sirketler,2026-07-03
EPLAS,EPLAS.IS,EGEPLAST EGE PLASTİK TİCARET VE SANAYİ A.Ş.,XIST,TRY,equity,true,true,https://www.kap.org.tr/tr/bist-sirketler,2026-07-03
ERBOS,ERBOS.IS,ERBOSAN ERCİYAS BORU SANAYİ VE TİCARET A.Ş.,XIST,TRY,equity,true,true,https://www.kap.org.tr/tr/bist-sirketler,2026-07-03
ERCB,ERCB.IS,ERCİYAS ÇELİK BORU SANAYİ A.Ş.,XIST,TRY,equity,true,true,https://www.kap.org.tr/tr/bist-sirketler,2026-07-03
EREGL,EREGL.IS,EREĞLİ DEMİR VE ÇELİK FABRİKALARI T.A.Ş.,XIST,TRY,equity,true,true,https://www.kap.org.tr/tr/bist-sirketler,2026-07-03
ERGLI,ERGLI.IS,EREĞLİ TEKSTİL TURİZM SANAYİ VE TİCARET A.Ş.,XIST,TRY,equity,true,true,https://www.kap.org.tr/tr/bist-sirketler,2026-07-03
ERSU,ERSU.IS,ERSU MEYVE VE GIDA SANAYİ A.Ş.,XIST,TRY,equity,true,true,https://www.kap.org.tr/tr/bist-sirketler,2026-07-03
ESCAR,ESCAR.IS,ESCAR FİLO KİRALAMA HİZMETLERİ A.Ş.,XIST,TRY,equity,true,true,https://www.kap.org.tr/tr/bist-sirketler,2026-07-03
ESCOM,ESCOM.IS,ESCORT TEKNOLOJİ YATIRIM A.Ş.,XIST,TRY,equity,true,true,https://www.kap.org.tr/tr/bist-sirketler,2026-07-03
ESEN,ESEN.IS,ESENBOĞA ELEKTRİK ÜRETİM A.Ş.,XIST,TRY,equity,true,true,https://www.kap.org.tr/tr/bist-sirketler,2026-07-03
ETILR,ETILR.IS,ETİLER GIDA VE TİCARİ YATIRIMLAR SANAYİ VE TİCARET A.Ş.,XIST,TRY,equity,true,true,https://www.kap.org.tr/tr/bist-sirketler,2026-07-03
ETYAT,ETYAT.IS,EURO TREND YATIRIM ORTAKLIĞI A.Ş.,XIST,TRY,equity,true,true,https://www.kap.org.tr/tr/bist-sirketler,2026-07-03
EUHOL,EUHOL.IS,EURO YATIRIM HOLDİNG A.Ş.,XIST,TRY,equity,true,true,https://www.kap.org.tr/tr/bist-sirketler,2026-07-03
EUKYO,EUKYO.IS,EURO KAPİTAL YATIRIM ORTAKLIĞI A.Ş.,XIST,TRY,equity,true,true,https://www.kap.org.tr/tr/bist-sirketler,2026-07-03
EUPWR,EUPWR.IS,EUROPOWER ENERJİ VE OTOMASYON TEKNOLOJİLERİ SANAYİ TİCARET A.Ş.,XIST,TRY,equity,true,true,https://www.kap.org.tr/tr/bist-sirketler,2026-07-03
EUREN,EUREN.IS,EUROPEN ENDÜSTRİ İNŞAAT SANAYİ VE TİCARET A.Ş.,XIST,TRY,equity,true,true,https://www.kap.org.tr/tr/bist-sirketler,2026-07-03
EUYO,EUYO.IS,EURO MENKUL KIYMET YATIRIM ORTAKLIĞI A.Ş.,XIST,TRY,equity,true,true,https://www.kap.org.tr/tr/bist-sirketler,2026-07-03
EYGYO,EYGYO.IS,EYG GAYRİMENKUL YATIRIM ORTAKLIĞI A.Ş.,XIST,TRY,equity,true,true,https://www.kap.org.tr/tr/bist-sirketler,2026-07-03
FADE,FADE.IS,FADE GIDA YATIRIM SANAYİ TİCARET A.Ş.,XIST,TRY,equity,true,true,https://www.kap.org.tr/tr/bist-sirketler,2026-07-03
FAIRF,FAIRF.IS,FAİR FİNANSMAN A.Ş.,XIST,TRY,equity,true,true,https://www.kap.org.tr/tr/bist-sirketler,2026-07-03
FBBNK,FBBNK.IS,FİBABANKA A.Ş.,XIST,TRY,equity,true,true,https://www.kap.org.tr/tr/bist-sirketler,2026-07-03
FENER,FENER.IS,FENERBAHÇE FUTBOL A.Ş.,XIST,TRY,equity,true,true,https://www.kap.org.tr/tr/bist-sirketler,2026-07-03
FKPET,FKPET.IS,FİKRET PETROL ÜRÜNLERİ PAZARLAMA SANAYİ VE TİCARET A.Ş.,XIST,TRY,equity,true,true,https://www.kap.org.tr/tr/bist-sirketler,2026-07-03
FLAP,FLAP.IS,FLAP KONGRE TOPLANTI HİZMETLERİ OTOMOTİV VE TURİZM A.Ş.,XIST,TRY,equity,true,true,https://www.kap.org.tr/tr/bist-sirketler,2026-07-03
FMIZP,FMIZP.IS,FEDERAL MOGUL İZMİT PİSTON VE PİM ÜRETİM TESİSLERİ A.Ş.,XIST,TRY,equity,true,true,https://www.kap.org.tr/tr/bist-sirketler,2026-07-03
FONET,FONET.IS,FONET BİLGİ TEKNOLOJİLERİ A.Ş.,XIST,TRY,equity,true,true,https://www.kap.org.tr/tr/bist-sirketler,2026-07-03
FORMT,FORMT.IS,FORMET METAL VE CAM SANAYİ A.Ş.,XIST,TRY,equity,true,true,https://www.kap.org.tr/tr/bist-sirketler,2026-07-03
FORTE,FORTE.IS,FORTE BİLGİ İLETİŞİM TEKNOLOJİLERİ VE SAVUNMA SANAYİ A.Ş.,XIST,TRY,equity,true,true,https://www.kap.org.tr/tr/bist-sirketler,2026-07-03
FRIGO,FRIGO.IS,FRİGO-PAK GIDA MADDELERİ SANAYİ VE TİCARET A.Ş.,XIST,TRY,equity,true,true,https://www.kap.org.tr/tr/bist-sirketler,2026-07-03
FRMPL,FRMPL.IS,FORMÜL PLASTİK VE METAL SANAYİ A.Ş.,XIST,TRY,equity,true,true,https://www.kap.org.tr/tr/bist-sirketler,2026-07-03
FROTO,FROTO.IS,FORD OTOMOTİV SANAYİ A.Ş.,XIST,TRY,equity,true,true,https://www.kap.org.tr/tr/bist-sirketler,2026-07-03
FZLGY,FZLGY.IS,FUZUL GAYRİMENKUL YATIRIM ORTAKLIĞI A.Ş.,XIST,TRY,equity,true,true,https://www.kap.org.tr/tr/bist-sirketler,2026-07-03
GARFA,GARFA.IS,GARANTİ FAKTORİNG A.Ş.,XIST,TRY,equity,true,true,https://www.kap.org.tr/tr/bist-sirketler,2026-07-03
GARFL,GARFL.IS,GARANTİ FİLO YÖNETİM HİZMETLERİ A.Ş.,XIST,TRY,equity,true,true,https://www.kap.org.tr/tr/bist-sirketler,2026-07-03
GATEG,GATEG.IS,GATE GROUP TEKNOLOJİ MEDYA VE SİBER GÜVENLİK HİZMETLERİ A.Ş.,XIST,TRY,equity,true,true,https://www.kap.org.tr/tr/bist-sirketler,2026-07-03
GEDIK,GEDIK.IS,GEDİK YATIRIM MENKUL DEĞERLER A.Ş.,XIST,TRY,equity,true,true,https://www.kap.org.tr/tr/bist-sirketler,2026-07-03
GEDZA,GEDZA.IS,GEDİZ AMBALAJ SANAYİ VE TİCARET A.Ş.,XIST,TRY,equity,true,true,https://www.kap.org.tr/tr/bist-sirketler,2026-07-03
GENIL,GENIL.IS,GEN İLAÇ VE SAĞLIK ÜRÜNLERİ SANAYİ VE TİCARET A.Ş.,XIST,TRY,equity,true,true,https://www.kap.org.tr/tr/bist-sirketler,2026-07-03
GENKM,GENKM.IS,GENTAŞ KİMYA SANAYİ VE TİCARET PAZARLAMA A.Ş.,XIST,TRY,equity,true,true,https://www.kap.org.tr/tr/bist-sirketler,2026-07-03
GENTS,GENTS.IS,GENTAŞ DEKORATİF YÜZEYLER SANAYİ VE TİCARET A.Ş.,XIST,TRY,equity,true,true,https://www.kap.org.tr/tr/bist-sirketler,2026-07-03
GEREL,GEREL.IS,GERSAN ELEKTRİK TİCARET VE SANAYİ A.Ş.,XIST,TRY,equity,true,true,https://www.kap.org.tr/tr/bist-sirketler,2026-07-03
GESAN,GESAN.IS,GİRİŞİM ELEKTRİK SANAYİ TAAHHÜT VE TİCARET A.Ş.,XIST,TRY,equity,true,true,https://www.kap.org.tr/tr/bist-sirketler,2026-07-03
GGBVK,GGBVK.IS,GOLDEN GLOBAL VARLIK KİRALAMA A.Ş.,XIST,TRY,equity,true,true,https://www.kap.org.tr/tr/bist-sirketler,2026-07-03
GIPTA,GIPTA.IS,GIPTA OFİS KIRTASİYE VE PROMOSYON ÜRÜNLERİ İMALAT SANAYİ A.Ş.,XIST,TRY,equity,true,true,https://www.kap.org.tr/tr/bist-sirketler,2026-07-03
GLBMD,GLBMD.IS,GLOBAL MENKUL DEĞERLER A.Ş.,XIST,TRY,equity,true,true,https://www.kap.org.tr/tr/bist-sirketler,2026-07-03
GLCVY,GLCVY.IS,GELECEK VARLIK YÖNETİMİ A.Ş.,XIST,TRY,equity,true,true,https://www.kap.org.tr/tr/bist-sirketler,2026-07-03
GLRMK,GLRMK.IS,GÜLERMAK AĞIR SANAYİ İNŞAAT VE TAAHHÜT A.Ş.,XIST,TRY,equity,true,true,https://www.kap.org.tr/tr/bist-sirketler,2026-07-03
GLRYH,GLRYH.IS,GÜLER YATIRIM HOLDİNG A.Ş.,XIST,TRY,equity,true,true,https://www.kap.org.tr/tr/bist-sirketler,2026-07-03
GLYHO,GLYHO.IS,GLOBAL YATIRIM HOLDİNG A.Ş.,XIST,TRY,equity,true,true,https://www.kap.org.tr/tr/bist-sirketler,2026-07-03
GMTAS,GMTAS.IS,GİMAT MAĞAZACILIK SANAYİ VE TİCARET A.Ş.,XIST,TRY,equity,true,true,https://www.kap.org.tr/tr/bist-sirketler,2026-07-03
GOKNR,GOKNR.IS,GÖKNUR GIDA MADDELERİ ENERJİ İMALAT İTHALAT İHRACAT TİCARET VE SANAYİ A.Ş.,XIST,TRY,equity,true,true,https://www.kap.org.tr/tr/bist-sirketler,2026-07-03
GOLTS,GOLTS.IS,GÖLTAŞ GÖLLER BÖLGESİ ÇİMENTO SANAYİ VE TİCARET A.Ş.,XIST,TRY,equity,true,true,https://www.kap.org.tr/tr/bist-sirketler,2026-07-03
GOODY,GOODY.IS,GOODYEAR LASTİKLERİ T.A.Ş.,XIST,TRY,equity,true,true,https://www.kap.org.tr/tr/bist-sirketler,2026-07-03
GOZDE,GOZDE.IS,GÖZDE GİRİŞİM SERMAYESİ YATIRIM ORTAKLIĞI A.Ş.,XIST,TRY,equity,true,true,https://www.kap.org.tr/tr/bist-sirketler,2026-07-03
GRNYO,GRNYO.IS,GARANTİ YATIRIM ORTAKLIĞI A.Ş.,XIST,TRY,equity,true,true,https://www.kap.org.tr/tr/bist-sirketler,2026-07-03
GRSEL,GRSEL.IS,GÜR-SEL TURİZM TAŞIMACILIK VE SERVİS TİCARET A.Ş.,XIST,TRY,equity,true,true,https://www.kap.org.tr/tr/bist-sirketler,2026-07-03
GRTHO,GRTHO.IS,GRAINTURK HOLDİNG A.Ş.,XIST,TRY,equity,true,true,https://www.kap.org.tr/tr/bist-sirketler,2026-07-03
GSDDE,GSDDE.IS,GSD DENİZCİLİK GAYRİMENKUL İNŞAAT SANAYİ VE TİCARET A.Ş.,XIST,TRY,equity,true,true,https://www.kap.org.tr/tr/bist-sirketler,2026-07-03
GSDHO,GSDHO.IS,GSD HOLDİNG A.Ş.,XIST,TRY,equity,true,true,https://www.kap.org.tr/tr/bist-sirketler,2026-07-03
GSIPD,GSIPD.IS,GOLDMAN SACHS INTERNATIONAL,XIST,TRY,equity,true,true,https://www.kap.org.tr/tr/bist-sirketler,2026-07-03
GSRAY,GSRAY.IS,GALATASARAY SPORTİF SINAİ VE TİCARİ YATIRIMLAR A.Ş.,XIST,TRY,equity,true,true,https://www.kap.org.tr/tr/bist-sirketler,2026-07-03
GUBRF,GUBRF.IS,GÜBRE FABRİKALARI T.A.Ş.,XIST,TRY,equity,true,true,https://www.kap.org.tr/tr/bist-sirketler,2026-07-03
GUNDG,GUNDG.IS,GÜNDOĞDU GIDA SÜT ÜRÜNLERİ SANAYİ VE DIŞ TİCARET A.Ş.,XIST,TRY,equity,true,true,https://www.kap.org.tr/tr/bist-sirketler,2026-07-03
GWIND,GWIND.IS,GALATA WIND ENERJİ A.Ş.,XIST,TRY,equity,true,true,https://www.kap.org.tr/tr/bist-sirketler,2026-07-03
GYVAR,GYVAR.IS,GY VARLIK KİRALAMA A.Ş.,XIST,TRY,equity,true,true,https://www.kap.org.tr/tr/bist-sirketler,2026-07-03
GZNMI,GZNMI.IS,GEZİNOMİ SEYAHAT TURİZM TİCARET A.Ş.,XIST,TRY,equity,true,true,https://www.kap.org.tr/tr/bist-sirketler,2026-07-03
HALKF,HALKF.IS,HALK FİNANSAL KİRALAMA A.Ş.,XIST,TRY,equity,true,true,https://www.kap.org.tr/tr/bist-sirketler,2026-07-03
HATEK,HATEK.IS,HATEKS HATAY TEKSTİL İŞLETMELERİ A.Ş.,XIST,TRY,equity,true,true,https://www.kap.org.tr/tr/bist-sirketler,2026-07-03
HATSN,HATSN.IS,HAT-SAN GEMİ İNŞAA BAKIM ONARIM DENİZ NAKLİYAT SANAYİ VE TİCARET A.Ş.,XIST,TRY,equity,true,true,https://www.kap.org.tr/tr/bist-sirketler,2026-07-03
HAYVK,HAYVK.IS,HAYAT VARLIK KİRALAMA A.Ş.,XIST,TRY,equity,true,true,https://www.kap.org.tr/tr/bist-sirketler,2026-07-03
HDFFL,HDFFL.IS,HEDEF ARAÇ KİRALAMA VE SERVİS A.Ş.,XIST,TRY,equity,true,true,https://www.kap.org.tr/tr/bist-sirketler,2026-07-03
HDFGS,HDFGS.IS,HEDEF GİRİŞİM SERMAYESİ YATIRIM ORTAKLIĞI A.Ş.,XIST,TRY,equity,true,true,https://www.kap.org.tr/tr/bist-sirketler,2026-07-03
HDFVK,HDFVK.IS,HEDEF VARLIK KİRALAMA A.Ş.,XIST,TRY,equity,true,true,https://www.kap.org.tr/tr/bist-sirketler,2026-07-03
HEDEF,HEDEF.IS,HEDEF HOLDİNG A.Ş.,XIST,TRY,equity,true,true,https://www.kap.org.tr/tr/bist-sirketler,2026-07-03
HEKTS,HEKTS.IS,HEKTAŞ TİCARET T.A.Ş.,XIST,TRY,equity,true,true,https://www.kap.org.tr/tr/bist-sirketler,2026-07-03
HKTM,HKTM.IS,HİDROPAR HAREKET KONTROL TEKNOLOJİLERİ MERKEZİ SANAYİ VE TİCARET A.Ş.,XIST,TRY,equity,true,true,https://www.kap.org.tr/tr/bist-sirketler,2026-07-03
HLGYO,HLGYO.IS,HALK GAYRİMENKUL YATIRIM ORTAKLIĞI A.Ş.,XIST,TRY,equity,true,true,https://www.kap.org.tr/tr/bist-sirketler,2026-07-03
HLVKS,HLVKS.IS,HALK VARLIK KİRALAMA A.Ş.,XIST,TRY,equity,true,true,https://www.kap.org.tr/tr/bist-sirketler,2026-07-03
HOROZ,HOROZ.IS,HOROZ LOJİSTİK KARGO HİZMETLERİ VE TİCARET A.Ş.,XIST,TRY,equity,true,true,https://www.kap.org.tr/tr/bist-sirketler,2026-07-03
HRKET,HRKET.IS,HAREKET PROJE TAŞIMACILIĞI VE YÜK MÜHENDİSLİĞİ A.Ş.,XIST,TRY,equity,true,true,https://www.kap.org.tr/tr/bist-sirketler,2026-07-03
HTTBT,HTTBT.IS,HİTİT BİLGİSAYAR HİZMETLERİ A.Ş.,XIST,TRY,equity,true,true,https://www.kap.org.tr/tr/bist-sirketler,2026-07-03
HUBVC,HUBVC.IS,HUB GİRİŞİM SERMAYESİ YATIRIM ORTAKLIĞI A.Ş.,XIST,TRY,equity,true,true,https://www.kap.org.tr/tr/bist-sirketler,2026-07-03
HUNER,HUNER.IS,HUN YENİLENEBİLİR ENERJİ ÜRETİM A.Ş.,XIST,TRY,equity,true,true,https://www.kap.org.tr/tr/bist-sirketler,2026-07-03
HURGZ,HURGZ.IS,HÜRRİYET GAZETECİLİK VE MATBAACILIK A.Ş.,XIST,TRY,equity,true,true,https://www.kap.org.tr/tr/bist-sirketler,2026-07-03
HUZFA,HUZFA.IS,HUZUR FAKTORİNG A.Ş.,XIST,TRY,equity,true,true,https://www.kap.org.tr/tr/bist-sirketler,2026-07-03
ICBCT,ICBCT.IS,ICBC TURKEY BANK A.Ş.,XIST,TRY,equity,true,true,https://www.kap.org.tr/tr/bist-sirketler,2026-07-03
ICUGS,ICUGS.IS,ICU GİRİŞİM SERMAYESİ YATIRIM ORTAKLIĞI A.Ş.,XIST,TRY,equity,true,true,https://www.kap.org.tr/tr/bist-sirketler,2026-07-03
IDGYO,IDGYO.IS,İDEALİST GAYRİMENKUL YATIRIM ORTAKLIĞI A.Ş.,XIST,TRY,equity,true,true,https://www.kap.org.tr/tr/bist-sirketler,2026-07-03
IEYHO,IEYHO.IS,IŞIKLAR ENERJİ VE YAPI HOLDİNG A.Ş.,XIST,TRY,equity,true,true,https://www.kap.org.tr/tr/bist-sirketler,2026-07-03
IHAAS,IHAAS.IS,İHLAS HABER AJANSI A.Ş.,XIST,TRY,equity,true,true,https://www.kap.org.tr/tr/bist-sirketler,2026-07-03
IHEVA,IHEVA.IS,İHLAS EV ALETLERİ İMALAT SANAYİ VE TİCARET A.Ş.,XIST,TRY,equity,true,true,https://www.kap.org.tr/tr/bist-sirketler,2026-07-03
IHGZT,IHGZT.IS,İHLAS GAZETECİLİK A.Ş.,XIST,TRY,equity,true,true,https://www.kap.org.tr/tr/bist-sirketler,2026-07-03
IHLAS,IHLAS.IS,İHLAS HOLDİNG A.Ş.,XIST,TRY,equity,true,true,https://www.kap.org.tr/tr/bist-sirketler,2026-07-03
IHLGM,IHLGM.IS,İHLAS GAYRİMENKUL PROJE GELİŞTİRME VE TİCARET A.Ş.,XIST,TRY,equity,true,true,https://www.kap.org.tr/tr/bist-sirketler,2026-07-03
IHYAY,IHYAY.IS,İHLAS YAYIN HOLDİNG A.Ş.,XIST,TRY,equity,true,true,https://www.kap.org.tr/tr/bist-sirketler,2026-07-03
IMASM,IMASM.IS,İMAŞ MAKİNA SANAYİ A.Ş.,XIST,TRY,equity,true,true,https://www.kap.org.tr/tr/bist-sirketler,2026-07-03
INDES,INDES.IS,İNDEKS BİLGİSAYAR SİSTEMLERİ MÜHENDİSLİK SANAYİ VE TİCARET A.Ş.,XIST,TRY,equity,true,true,https://www.kap.org.tr/tr/bist-sirketler,2026-07-03
INGRM,INGRM.IS,INGRAM MİCRO BİLİŞİM SİSTEMLERİ A.Ş.,XIST,TRY,equity,true,true,https://www.kap.org.tr/tr/bist-sirketler,2026-07-03
INTEK,INTEK.IS,İNNOSA TEKNOLOJİ A.Ş.,XIST,TRY,equity,true,true,https://www.kap.org.tr/tr/bist-sirketler,2026-07-03
INTEM,INTEM.IS,İNTEMA İNŞAAT VE TESİSAT MALZEMELERİ YATIRIM VE PAZARLAMA A.Ş.,XIST,TRY,equity,true,true,https://www.kap.org.tr/tr/bist-sirketler,2026-07-03
INVAZ,INVAZ.IS,INVEST-AZ YATIRIM MENKUL DEĞERLER A.Ş.,XIST,TRY,equity,true,true,https://www.kap.org.tr/tr/bist-sirketler,2026-07-03
INVEO,INVEO.IS,INVEO YATIRIM HOLDİNG A.Ş.,XIST,TRY,equity,true,true,https://www.kap.org.tr/tr/bist-sirketler,2026-07-03
INVES,INVES.IS,INVESTCO HOLDİNG A.Ş.,XIST,TRY,equity,true,true,https://www.kap.org.tr/tr/bist-sirketler,2026-07-03
ISBIR,ISBIR.IS,İŞBİR HOLDİNG A.Ş.,XIST,TRY,equity,true,true,https://www.kap.org.tr/tr/bist-sirketler,2026-07-03
ISDMR,ISDMR.IS,İSKENDERUN DEMİR VE ÇELİK A.Ş.,XIST,TRY,equity,true,true,https://www.kap.org.tr/tr/bist-sirketler,2026-07-03
ISFAK,ISFAK.IS,İŞ FAKTORİNG A.Ş.,XIST,TRY,equity,true,true,https://www.kap.org.tr/tr/bist-sirketler,2026-07-03
ISFIN,ISFIN.IS,İŞ FİNANSAL KİRALAMA A.Ş.,XIST,TRY,equity,true,true,https://www.kap.org.tr/tr/bist-sirketler,2026-07-03
ISGSY,ISGSY.IS,İŞ GİRİŞİM SERMAYESİ YATIRIM ORTAKLIĞI A.Ş.,XIST,TRY,equity,true,true,https://www.kap.org.tr/tr/bist-sirketler,2026-07-03
ISGYO,ISGYO.IS,İŞ GAYRİMENKUL YATIRIM ORTAKLIĞI A.Ş.,XIST,TRY,equity,true,true,https://www.kap.org.tr/tr/bist-sirketler,2026-07-03
ISKPL,ISKPL.IS,IŞIK PLASTİK SANAYİ VE DIŞ TİCARET PAZARLAMA A.Ş.,XIST,TRY,equity,true,true,https://www.kap.org.tr/tr/bist-sirketler,2026-07-03
ISSEN,ISSEN.IS,İŞBİR SENTETİK DOKUMA SANAYİ A.Ş.,XIST,TRY,equity,true,true,https://www.kap.org.tr/tr/bist-sirketler,2026-07-03
ISTFK,ISTFK.IS,İSTANBUL FAKTORİNG A.Ş.,XIST,TRY,equity,true,true,https://www.kap.org.tr/tr/bist-sirketler,2026-07-03
ISTVY,ISTVY.IS,İSTANBUL VARLIK YÖNETİM A.Ş.,XIST,TRY,equity,true,true,https://www.kap.org.tr/tr/bist-sirketler,2026-07-03
ISYAT,ISYAT.IS,İŞ YATIRIM ORTAKLIĞI A.Ş.,XIST,TRY,equity,true,true,https://www.kap.org.tr/tr/bist-sirketler,2026-07-03
IZENR,IZENR.IS,İZDEMİR ENERJİ ELEKTRİK ÜRETİM A.Ş.,XIST,TRY,equity,true,true,https://www.kap.org.tr/tr/bist-sirketler,2026-07-03
IZFAS,IZFAS.IS,İZMİR FIRÇA SANAYİ VE TİCARET A.Ş.,XIST,TRY,equity,true,true,https://www.kap.org.tr/tr/bist-sirketler,2026-07-03
IZINV,IZINV.IS,İZ YATIRIM HOLDİNG A.Ş.,XIST,TRY,equity,true,true,https://www.kap.org.tr/tr/bist-sirketler,2026-07-03
IZMDC,IZMDC.IS,İZMİR DEMİR ÇELİK SANAYİ A.Ş.,XIST,TRY,equity,true,true,https://www.kap.org.tr/tr/bist-sirketler,2026-07-03
JANTS,JANTS.IS,JANTSA JANT SANAYİ VE TİCARET A.Ş.,XIST,TRY,equity,true,true,https://www.kap.org.tr/tr/bist-sirketler,2026-07-03
KAPLM,KAPLM.IS,KAPLAMİN AMBALAJ SANAYİ VE TİCARET A.Ş.,XIST,TRY,equity,true,true,https://www.kap.org.tr/tr/bist-sirketler,2026-07-03
KAREL,KAREL.IS,KAREL ELEKTRONİK SANAYİ VE TİCARET A.Ş.,XIST,TRY,equity,true,true,https://www.kap.org.tr/tr/bist-sirketler,2026-07-03
KARSN,KARSN.IS,KARSAN OTOMOTİV SANAYİİ VE TİCARET A.Ş.,XIST,TRY,equity,true,true,https://www.kap.org.tr/tr/bist-sirketler,2026-07-03
KARTN,KARTN.IS,KARTONSAN KARTON SANAYİ VE TİCARET A.Ş.,XIST,TRY,equity,true,true,https://www.kap.org.tr/tr/bist-sirketler,2026-07-03
KATMR,KATMR.IS,KATMERCİLER ARAÇ ÜSTÜ EKİPMAN SANAYİ VE TİCARET A.Ş.,XIST,TRY,equity,true,true,https://www.kap.org.tr/tr/bist-sirketler,2026-07-03
KATVK,KATVK.IS,KATILIM VARLIK KİRALAMA A.Ş.,XIST,TRY,equity,true,true,https://www.kap.org.tr/tr/bist-sirketler,2026-07-03
KAYSE,KAYSE.IS,KAYSERİ ŞEKER FABRİKASI A.Ş.,XIST,TRY,equity,true,true,https://www.kap.org.tr/tr/bist-sirketler,2026-07-03
KBORU,KBORU.IS,KUZEY BORU A.Ş.,XIST,TRY,equity,true,true,https://www.kap.org.tr/tr/bist-sirketler,2026-07-03
KCAER,KCAER.IS,KOCAER ÇELİK SANAYİ VE TİCARET A.Ş.,XIST,TRY,equity,true,true,https://www.kap.org.tr/tr/bist-sirketler,2026-07-03
KCHOL,KCHOL.IS,KOÇ HOLDİNG A.Ş.,XIST,TRY,equity,true,true,https://www.kap.org.tr/tr/bist-sirketler,2026-07-03
KENT,KENT.IS,KENT GIDA MADDELERİ SANAYİİ VE TİCARET A.Ş.,XIST,TRY,equity,true,true,https://www.kap.org.tr/tr/bist-sirketler,2026-07-03
KERVN,KERVN.IS,KERVANSARAY YATIRIM HOLDİNG A.Ş.,XIST,TRY,equity,true,true,https://www.kap.org.tr/tr/bist-sirketler,2026-07-03
KFEIN,KFEIN.IS,KAFEİN YAZILIM HİZMETLERİ TİCARET A.Ş.,XIST,TRY,equity,true,true,https://www.kap.org.tr/tr/bist-sirketler,2026-07-03
KFILO,KFILO.IS,KAYATUR FİLO KİRALAMA A.Ş.,XIST,TRY,equity,true,true,https://www.kap.org.tr/tr/bist-sirketler,2026-07-03
KGYO,KGYO.IS,KORAY GAYRİMENKUL YATIRIM ORTAKLIĞI A.Ş.,XIST,TRY,equity,true,true,https://www.kap.org.tr/tr/bist-sirketler,2026-07-03
KIMMR,KIMMR.IS,ERSAN ALIŞVERİŞ HİZMETLERİ VE GIDA SANAYİ TİCARET A.Ş.,XIST,TRY,equity,true,true,https://www.kap.org.tr/tr/bist-sirketler,2026-07-03
KLGYO,KLGYO.IS,KİLER GAYRİMENKUL YATIRIM ORTAKLIĞI A.Ş.,XIST,TRY,equity,true,true,https://www.kap.org.tr/tr/bist-sirketler,2026-07-03
KLKIM,KLKIM.IS,KALEKİM KİMYEVİ MADDELER SANAYİ VE TİCARET A.Ş.,XIST,TRY,equity,true,true,https://www.kap.org.tr/tr/bist-sirketler,2026-07-03
KLMSN,KLMSN.IS,KLİMASAN KLİMA SANAYİ VE TİCARET A.Ş.,XIST,TRY,equity,true,true,https://www.kap.org.tr/tr/bist-sirketler,2026-07-03
KLNMA,KLNMA.IS,TÜRKİYE KALKINMA VE YATIRIM BANKASI A.Ş.,XIST,TRY,equity,true,true,https://www.kap.org.tr/tr/bist-sirketler,2026-07-03
